2017-11-07 13:25:24,No problem! Glad to hear you were able to speak with someone. Have a great day! ^TF
2017-11-07 13:25:01,"Thanks! Do you have any other services with us? If so, are they down too? ^TF"
2017-11-07 13:22:36,Hello! We'll see if we can help get it going again. Have you done any troubleshooting so far? ^TF
2017-11-07 13:19:41,Thanks! We can take a closer look if you DM the phone #and address on the account. ^TF
2017-11-07 13:16:20,"Hi Linda, not seeing anything reported right now. What kind of problem are you having? ^TF"
2017-11-07 12:10:06,Glad to hear you got help! I do apologize for the experience and if we can assist please give us a shout! ^Harvey
2017-11-07 11:41:46,"Hey, could you send me a DM with your account info? I'd like to look review this. ^Harvey"
2017-11-07 11:12:25,"Hi Chris, I don't see any reported issues. Have you done any troubleshooting so far? ^TF"
2017-11-07 11:08:49,"Hi Michael, please DM your account information and we can take a look to see what your options are. Thanks! ^TF"
2017-11-07 11:06:34,You're welcome! Let us know if we can help with anything else. Have a great day! ^TF
2017-11-07 11:06:17,"The Stingray Christmas music channel is usually around the same time, so most likely end of November. ^TF"
2017-11-07 11:05:46,"The Fire Log channel usually comes out near the end of November, but it's also on VOD (for free) here: https:// vod.shaw.ca/details/216160 /shaw_fire_log/ … ^TF"
2017-11-07 11:02:13,"Hi Kyle, we can look into this for you. Which music channel are you looking for? ^TF"
2017-11-07 10:58:33,Hi Alister! BeIN sports is available for $16 per month plus tax. ^TF
2017-11-07 10:56:01,"Hi Dale, sorry about that! We can investigate if you report the error via https://www. shaw.ca/Secure/support /television/guide-errors/form.aspx … Thanks! ^TF"
2017-11-07 10:54:46,"Hi Steve, FreeRange TV is an app designed for cable subscribers to be able to access live TV when away from home. ^TF"
2017-11-07 10:52:56,We can take a closer look. Can you please send us a DM with the phone #and address on the account? Thanks! ^TF
2017-11-07 10:49:27,Hi Gina! Not seeing anything reported for that area right now. Which services are you having trouble with? ^TF
2017-11-07 10:46:30,That's awesome! Definitely above and beyond! :) ^TF
2017-11-07 10:42:28,"Hi Amanda! We always love getting positive feedback. You can DM the info, or you can fill out https://www. shaw.ca/contact-us/you r-voice/Provide-Feedback/#/ … ^TF"
2017-11-07 10:32:55,Excellent! Glad to hear that did the trick :) Have a great day! ^TF
2017-11-07 10:15:13,"I had a similar issue over the weekend and turning off the box for a few seconds got it going again, so worth a shot! ^TF"
2017-11-07 10:14:53,"Hi Danielle, not aware of any widespread issues. Have you tried turning off the main box and then turning it back on? ^TF"
2017-11-07 10:04:33,Hi Melissa! Unfortunately it only supports English commands at the moment but we're working on adding French in the future. ^TF
2017-11-07 08:48:51,"Thanks! Hopefully was just a one time thing but if it happens again, please let us know! ^TF"
2017-11-07 08:12:46,"Hi Shawn, we have maintenance from time to time to make sure that your services are working at their best. Sorry for the inconvenience! ^TF"
2017-11-07 08:11:03,"Hey Naz, are you still having trouble with your Internet? Let us know if you need any assistance. Thanks! ^TF"
2017-11-07 08:10:39,"Good morning! We're here every day from 7am to 10pm Pacific time. If you need help after hours, 1-888-472-2222 is 24/7. ^TF"
2017-11-07 08:09:10,Good morning! Are you still having trouble with your Internet? Let us know if you need any assistance. Thanks! ^TF
2017-11-07 08:08:43,"Hi Harvey, are you still having trouble with your Internet? Please let us know if you need any assistance. Thanks! ^TF"
2017-11-07 08:06:42,Good morning! We can look into this for you if you send us a DM with your phone number and address. Thanks! ^TF
2017-11-07 08:04:10,"Hey Adam, we can look into this for you. Please feel free to send us a DM with your account info. Thanks! ^TF"
2017-11-07 08:03:34,"Was it just this episode, or is this an ongoing problem? ^TF"
2017-11-07 08:02:46,"You can try rebooting it, or sometimes I find it helps to disable WiFi and then re-enable it. ^TF"
2017-11-07 08:02:13,"If the phone works fine, then we know there's nothing wrong with the hotspot. I'd suggest doing some troubleshooting with the laptop. ^TF"
2017-11-07 08:00:35,"Hi Adrian, we're happy to see if we can help. Please feel free to send us a DM with your account info so we can take a look. Thanks! ^TF"
2017-11-07 08:00:02,Good morning! The AM crew is here and ready to assist. Let us know if we can help!
2017-11-06 23:00:11,"Monday is a wrap! Off for the night, but we'll be right at 7am PST tmrw. Don't miss us too much in our absence :) Have a good one!"
2017-11-06 22:59:25,How close/far away are you from the hotspot though? Any other devices affected or just laptop? ^Ken
2017-11-06 22:49:30,"Haven't heard back yet; first time ever on issue or repeat? Just that one program, or did you notice others? ^Ken"
2017-11-06 22:42:43,"I suggest trying a remove and re-register of your laptop, http:// bit.ly/1sR1SY6 for more details on how-to. ^Ken"
2017-11-06 22:34:21,"Limited connection may mean wifi signal not as strong (depending on far you are away from access point), but should still work. ^Ken"
2017-11-06 22:33:24,"Is our modem going on/offline? Stable connection = first 4/5 lights remaining solid. If it is intermittent, you would see some offline ^Ken"
2017-11-06 22:32:49,"I see. First time ever or history of same issue? Just that one program, or others affected? ^Ken"
2017-11-06 22:20:53,"Definitely an oddity; if you have more than 1 TV, same issue on all or just one? Using a home theater system for audio or just from TV? ^Ken"
2017-11-06 22:20:17,"Sorry to hear that! What credentials are you using, a Shaw email account or My Shaw credentials? Tried removing profile online yet? ^Ken"
2017-11-06 21:25:35,"Is this on a wireless connection? If it is, http:// bit.ly/2dZLGEi for tips on how to get the most out of your package ^Ken"
2017-11-06 21:18:45,"Hey Akhilesh, if you need a hand with your account, plz DM us your account number for a look. Thx ^Ken"
2017-11-06 21:16:41,"Nothing that is area wide. For more tips and tricks, check out http:// bit.ly/13ui0Hu ^Ken"
2017-11-06 21:14:03,"No worries! Keep us updated on this one, hopefully reset does the trick. Cheers! ^Ken"
2017-11-06 21:07:21,"Hmm, sounds like you have our Gateway system; have you tried a reboot yet? If not, check out http:// bit.ly/GatewayRes and let us know ^Ken"
2017-11-06 20:59:59,What happens when you try to play it back? Any error msgs? ^Ken
2017-11-06 20:53:42,"Phew, good to hear! Give us a shout if you ever need a hand, cheers! ^Ken"
2017-11-06 20:42:38,"Have you checked if our modem's online (first 4 lights should be solid)? If you have own router, also may need to reboot. ^Ken"
2017-11-06 20:42:07,"Hey Lannie, nothing area-wide has been reported so far. Any error messages? What seems to be the issue with cable? ^Ken"
2017-11-06 20:41:22,"Hey Moe! If you ever need a hand, we're always here to help. Cheers! ^Ken"
2017-11-06 20:23:22,"Hello Jasjit, sorry to hear you're having trouble. If you follow and DM us, we can take a look into this for you. ^LD"
2017-11-06 20:10:02,"Hey AnAvgGuy, sorry to hear you're having trouble. Is it just wireless you are having trouble with or wired connections as well? ^LD"
2017-11-06 20:06:09,Perfect! ^LD
2017-11-06 19:57:57,The outage at the Minoru Park area only covers Minoru Blvd addresses. DM us your full address so I can check it out further for you! ^Steph
2017-11-06 19:50:55,Ouch :( Let us know if it persists; a reset may work if you have time during intermission. Keep us updated! ^Ken
2017-11-06 19:45:27,"Nothing reported at this time. What seems to be the issue? All TVs or certain one? Troubleshooting wise, what's tried so far? ^Ken"
2017-11-06 19:40:46,"Hey Lianne, thx for your feedback. Definitely not what we expected that night. If you ever need a hand, plz give us a shout anytime! ^Ken"
2017-11-06 19:16:39,"Hey Nicole. Netflix is accessible via our BlueSky TV equipment, check out http:// bit.ly/2wZ71tt for more details ^Ken"
2017-11-06 19:00:20,"Should be ok since it's a dual-tuner. Have you tried a reboot yet? If not, unplug pwr for at least 30s before reconnecting. ^Ken"
2017-11-06 18:53:58,"What's wrong with the service specifically? Troubleshooting wise, what's tried so far? ^Ken"
2017-11-06 18:53:39,"Glad to hear that it's working now, sorry for the blip, let us know if you ever need a hand. Cheers! ^Ken"
2017-11-06 18:12:15,"Hmm, very odd; the 2 series, are they on at the same time or staggered? Always been like this, or just a recent issue? ^Ken"
2017-11-06 17:43:20,"Doesn't appear to be a national game, only on Centre Ice, http:// bit.ly/2hH4R8j for schedule/details. Sorry for guide error ^Ken"
2017-11-06 17:31:21,"Hmm, if it's only wireless that is affected, could try adj wifi channel on our modem if you haven't tried. ^Ken"
2017-11-06 17:30:27,Sweet collection! ^Ken
2017-11-06 17:27:00,"Are you using own router? If so, try rebooting it. If only affecting wireless, confirm if ok via wired connection. ^Ken"
2017-11-06 17:24:58,"Hmm, on multiple Sportsnet channels or just one? What channel number? ^Ken"
2017-11-06 17:24:33,"Hey Brandon! Nothing so far; what services are affected? If internet only, is modem online (first 4 lights should be solid)? ^Ken"
2017-11-06 17:23:49,Hey Melissa! We only get licensing for titles for a certain time unfortunately. Hopefully more can be added soon. Sorry for troubles! ^Ken
2017-11-06 17:21:19,"Hey Jon, least we can after that fiasco. If you ever need a hand, please give us a shout anytime. Cheers! ^Ken"
2017-11-06 16:53:54,Have you tried other hotspots? Only 1 device affected or all that are registered on your acct? What's tried so far? ^Ken
2017-11-06 16:51:24,Sorry to hear that. Speeds does depend on how far/close you are to the access point. ^Ken
2017-11-06 16:40:34,"Hey Pam! Season 7 should be up (""Hiraeth"" and rest), check out http:// bit.ly/2ybHMSg for listings! ^Ken"
2017-11-06 16:26:27,"Phew, glad to hear! Sorry, Canucks fan out here in Van, we'll see you on the Dec 12th match up :) ^Ken"
2017-11-06 15:39:26,"Thanks Tristan, we do try our best! I'll pass this along to the rest of the team! ^LD"
2017-11-06 15:22:43,Glad to hear! :D ^Harvey
2017-11-06 15:22:23,"Its a great question! ShawPasspoint is available at most Shaw Go WiFi locations, not all. ^Harvey"
2017-11-06 14:53:46,LOL. Touche. ^Harvey
2017-11-06 13:51:17,Glad you love it! :) The app request is a popular one for sure. Will forward your feedback for both! Hope they both come soon. ^Harvey
2017-11-06 13:47:53,Thanks for keeping us posted! :) ^Harvey
2017-11-06 13:32:29,"Thanks, could you send me a DM with details of the box you are recording on? Be happy to take a closer look! ^Harvey https:// twitter.com/messages/compo se?recipient_id=216808077 …"
2017-11-06 13:28:15,"When you go to future recordings, does red circle have anything odd like lines through the circle? ^Lance"
2017-11-06 13:27:13,"Hey Paul, our apologies for your inconvenience. Technicians investigated and we don't want to see that happen again either. ^Lance"
2017-11-06 13:25:40,Is that on W? I'm not sure if it was new or a repeat. Hard to tell from their site. Premiere was Oct 22. Did any new episode record? ^Lance
2017-11-06 13:12:54,"Hi John. Do you have it set to 'new only' or are you recording all episodes, even older ones? ^Lance"
2017-11-06 12:51:08,Can you cycle the main Gateway unit by removing the power & coax? Reconnect it after 2 min. If that fails please DM me your act info ^Harvey
2017-11-06 12:48:08,Hey! Is that on all boxes or a single one? ^Harvey
2017-11-06 12:44:37,What is the light sequence on the modem? ^Harvey
2017-11-06 12:41:12,Hey! Haven't heard of any troubles in Calgary. What services are impacted? ^Harvey
2017-11-06 12:20:42,"Awe shucks, thanks Robert! Let us know how you like BlueSky TV :D ^Harvey"
2017-11-06 12:04:04,Sorry to hear about the experience! Could you DM me your account info? I'd be happy to review and forward your feedback. ^Harvey
2017-11-06 11:52:11,Thanks for the shout out! :) Appreciate it. Definitely going to share it with my team. ^Harvey
2017-11-06 11:50:28,Could you send me a DM with your account info? I can investigate. ^Harvey https:// twitter.com/messages/compo se?recipient_id=216808077 …
2017-11-06 11:42:30,Hey Kevin! No outages that I am aware of. What service is impacted? ^Harvey
2017-11-06 11:11:10,Glad to hear its up! :) Keep in touch Diana! ^Harvey
2017-11-06 09:54:12,Nice! Can you send me a DM with your acct info and delete this tweet? Does have your wifi info out open to the public. ;) ^Harvey https:// twitter.com/messages/compo se?recipient_id=216808077 …
2017-11-06 09:51:33,Hey Antony! I haven't heard of any troubles. What is the light sequence on your modem? ^Harvey
2017-11-06 08:49:38,Could you send me a DM with your account info? I want to take a closer look. ^Harvey https:// twitter.com/messages/compo se?recipient_id=216808077 …
2017-11-06 08:49:13,"Hey, our team is doing maintenance at the moment. No ETA but imagine it'll be back up soon! Was there anything I could help with? :) ^Harvey"
2017-11-06 08:29:00,"Hey Richard, send me a DM with your account info. Be happy to review your services and help make changes. ^Harvey https:// twitter.com/messages/compo se?recipient_id=216808077 …"
2017-11-06 08:23:23,Sorry to hear! I haven't heard of any troubles. Can you DM me your acct info? I can take a closer look! ^Harvey https:// twitter.com/messages/compo se?recipient_id=216808077 …
2017-11-06 08:22:34,Hey Davan! Could you DM me your account info? I'd love to review the conversation and forward your feedback. ^Harvey https:// twitter.com/messages/compo se?recipient_id=216808077 …
2017-11-06 08:21:47,Hey Jenna! Sorry to hear about the experience. Could you DM me your account info? I'd love to review this. ^Harvey https:// twitter.com/messages/compo se?recipient_id=216808077 …
2017-11-06 08:12:55,Hey Mathew! It only happens during the night? Otherwise is good in the morning/afternoons? ^Harvey
2017-11-06 08:12:17,Sorry to hear Alistar! Bad timing for troubles... Are services back up this morning? ^Harvey
2017-11-06 08:11:37,"Hey Jaye, sorry to hear about the troubles. If you could DM me your account info I'd be happy to review this and help get it fixed! ^Harvey https:// twitter.com/messages/compo se?recipient_id=216808077 …"
2017-11-06 08:10:22,"Hey Stu! Did you have UFC troubles? :( If you could DM me your account info, I'd be happy to review it. ^Harvey"
2017-11-06 08:03:40,Oh no! I am sorry to see that. Could you DM me your acct info? I'd be happy to look into this further. ^Harvey https:// twitter.com/messages/compo se?recipient_id=216808077 …
2017-11-06 08:02:50,Could you try that again but also remove the coax cable (screwy TV cable) for 2 min? If that fails please DM me your acct info! ^Harvey https:// twitter.com/messages/compo se?recipient_id=216808077 …
2017-11-06 08:00:33,Good morning Twitter! Hope you had a wonderful weekend. The morning crew is in and ready to assist.
2017-11-05 23:02:59,That's a wrap for tonight! We'll be back first thing in the morning if you require any assistance.
2017-11-05 23:02:22,Very sorry to hear of this Bogeywheels. If you could follow and DM us we would like to collect some information to follow up on this. ^LD
2017-11-05 22:04:11,You're welcome! ^LD
2017-11-05 22:01:50,That department doesn't do outbound calls. You can however reach them by calling us at 1-888-472-2222. ^LD
2017-11-05 21:52:42,"Hey Dennis, yes they are available till 10pm PT. ^LD"
2017-11-05 21:51:32,Perfect! Let us know if you see any further issues. ^LD
2017-11-05 21:48:20,"It looks like when the guide disappears, and the picture is just in the top corner. I was hoping a power cycle would fix it! ^LD"
2017-11-05 21:47:24,Hello HoopsfanAB. Is that channel 202 NBC? What station is showing up in place of NBC? ^LD
2017-11-05 21:30:16,"Sorry to hear that Alessandra. I've never seen that happen! Try pulling power out of the box for 2 min, then try the recording again. ^LD"
2017-11-05 21:29:18,"Try a reset on the modem. On the back is a pinhole. Press and hold for 1 min. If it continues, let us know as we may need another tech. ^LD"
2017-11-05 21:11:25,"When you lose connection, do you notice if the lights on the modem change? ^LD"
2017-11-05 20:46:30,"Hello SeijiFS, sorry to hear that. Just taking a look, I do see the Shaw modem is currently online. You are not able to connect? ^LD"
2017-11-05 20:37:25,"Good to hear! However just no, It may be intermittent until fully resolved. ^LD"
2017-11-05 20:26:58,"Hello Jasmine. We don't have an ETA for this at the moment, however you can find any updates here http:// bit.ly/2j4Hn1d ^LD"
2017-11-05 20:26:11,"Hello Angielyn, that is correct. We are working to resolve the issue now. You can find any updates here http:// bit.ly/2j4Hn1d ^LD"
2017-11-05 20:21:49,You're welcome! ^LD
2017-11-05 20:19:00,Hello Margaret. No ETA at the moment but any updates will be noted here http:// bit.ly/2j4Hn1d ^LD
2017-11-05 20:15:07,Sorry to hear Natalie. We are having a few issues in Vancouver at the moment. You can find updates here https:// community.shaw.ca/docs/DOC-13942 ^LD
2017-11-05 20:13:41,"Hello Kaare, we are having some issues at the moment. You can find any updates here http:// bit.ly/2j4Hn1d ^LD"
2017-11-05 20:10:37,It does look like an outage at the moment. Services may be intermittent. You can find any updates here http:// bit.ly/2j4Hn1d ^LD
2017-11-05 20:08:21,"Hey Pardave, yes it looks like the outage is not resolved. You can find any updates here http:// bit.ly/2j4Hn1d ^LD"
2017-11-05 19:57:01,"Hello Holly, I am starting to see some mention of it and looking into this now. ^LD"
2017-11-05 19:15:36,"Hello Denise. Yes the rerun should be working. If you have any trouble with it, do let us know! ^LD"
2017-11-05 19:12:55,Perfect! Let us know if you have any further trouble. ^LD
2017-11-05 19:06:24,Hello Kamal. Only issue currently is in North Vancouver. You can find updates here https:// community.shaw.ca/docs/DOC-13941 . Is that the area you are in? ^LD
2017-11-05 19:00:06,Perfect! Let us know if you do continue to have any trouble. ^LD
2017-11-05 18:58:13,You're welcome! ^LD
2017-11-05 18:57:29,Hello Tristan. I don't see anything noted as of yet. What lights are showing on the front of the modem? ^LD
2017-11-05 18:56:57,Oh perfect! Let us know if you do continue to have trouble. ^LD
2017-11-05 18:56:42,That is the Online light. Looks like we might be seeing an outage starting up in the area. Can you follow and DM your account info? ^LD
2017-11-05 18:46:46,"Hey Mike, sorry to hear that. That can often be due to a signal issues. Try some of the steps here https:// community.shaw.ca/docs/DOC-1030 to fix it. ^LD"
2017-11-05 18:45:52,Hello voxoris. I don't see any outages noted in the area. What lights are showing on the front of the modem? ^LD
2017-11-05 18:39:14,That sounds like it may be a signal issue. If you follow and DM your account info I can take a look for you. ^LD
2017-11-05 18:33:34,"Sorry to hear that Chelsea, you shouldn't have to do that. When you lose connection, do the lights on the modem change? ^LD"
2017-11-05 17:15:22,Hello Dustin. That would be the routing provided by the destination. If you try a trace route to Google what results do you see? ^LD
2017-11-05 16:50:11,You're welcome! ^LD
2017-11-05 16:50:01,"All of our VOD content is still available, including any that you are subscribed to such as The Movie Network or Super Channel content. ^LD"
2017-11-05 16:49:01,"Hello Jason. That is correct, you would need to bring in the old rental modem to swap it for the new one. ^LD"
2017-11-05 16:44:21,Hi Melissa. Netflix is not required to access any of our VOD content. It would only be needed to access anything in the Netflix library. ^LD
2017-11-05 15:38:51,"Hi Laura. We expect our techs to drive safe and courteously, to set the example. Could you DM more details please? ^Lance"
2017-11-05 15:19:46,"Sorry, it all depends on Hydro now. Hopefully they get services back up and running. Their techs are good, usually doesn't take long! ^Lance"
2017-11-05 15:17:23,Hi Kayla. Are you near Glastonbury area? Outage due to some of our equipment being in Hydro outage. Waiting on power to come back. ^Lance
2017-11-05 15:11:41,Hi Justin. Nothing that I'm seeing. Could you DM your address please? I can get more info for you. ^Lance
2017-11-05 14:51:55,"Hi Travis. If you'd like me to look at your account and look at options for you, please follow and DM. ^Lance"
2017-11-05 14:44:27,"Hi Jessy. The price is set with the broadcaster. And since it's a set price, there is no monthly rate. If you want it, it is $129. ^Lance"
2017-11-05 14:35:43,"Feel free to DM us if restarting phone, forgetting and reconnecting to Passpoint doesn't work. We can always send you up as example! ^Lance"
2017-11-05 14:33:30,"That's right, you should be able to connect to both ShawOpen and Passpoint through the same login. ^Lance"
2017-11-05 14:29:03,"Hmm, should work then. But we're getting reports of Passpoint rejecting some iPhones. Does phone have all updates? ^Lance"
2017-11-05 14:24:33,"Hey KK, what kind of phone do you have? Shawpoint only works with iPhones at this time. Some Androids but not most. ^Lance"
2017-11-05 14:22:35,"That might be okay since it's shipped from the warehouse, not retail. If stock is too low, they'll let you know. ^Lance"
2017-11-05 14:14:51,"Ah, that's because we're focusing on BlueSky TV. Any Gateways in stock would be at the warehouse for service call swaps. ^Lance"
2017-11-05 14:09:17,"If they know the serial number of the box they will purchase, they can reach out to us & we should be able to identify the warranty ^Harvey"
2017-11-05 14:03:49,Ah! No worries. :) ^Harvey
2017-11-05 14:03:27,"So if the box was purchased last year originally, and your friend got it now, would have 2 yr remaining. If 2 yr ago, then 1 yr. Etc ^Harvey"
2017-11-05 14:02:46,New boxes have a 3 year warranty and refurbished units would take on the warranty from the period it was purchased. (1/2) ^Harvey
2017-11-05 14:02:04,Yeah! If you to Sportsnet Go or TSN TV site online you should be able to log into access Live TV. ^Harvey
2017-11-05 13:58:42,And I believe the games would work from their app! 2/2 ^Harvey
2017-11-05 13:58:24,Hey Spencer! There are some blackout restrictions http:// bit.ly/1OeTcaE You could download the app of the provider (TSN/SN GO) 1/2 ^Harvey
2017-11-05 13:57:14,"Got you! Yeah, if they have a Pace/Motorola PVR hooking up a Gateway system shouldn't affect those boxes or recordings. ^Harvey"
2017-11-05 13:47:57,That depends on the other PVRs you may have. Could you send me your acct info via DM? I can see if its possible or not. ^Harvey
2017-11-05 13:39:34,Sorry to hear about the experience Courtney. Could you DM me your account info? Certainly like to review this! ^Harvey
2017-11-05 13:39:10,Hey! Sorry to hear about the troubles. Could you DM me your account info? I can look into this! ^Harvey
2017-11-05 13:10:49,"Hi Bart. If you're having technical issues, the retail staff might need to defer to tech support. What issues are you having? ^Lance"
2017-11-05 12:51:59,^Lance pic.twitter.com/EuWuTws8xJ
2017-11-05 12:51:44,That's odd. Could you send a DM and confirm your address or account number? Let's take a look from this side. ^Lance
2017-11-05 12:46:30,"Ah, that's not good. :( Hopefully just a quick overnight blip. Let us know if it happens again. ^Lance"
2017-11-05 12:42:41,Might be one not reported yet. Could you DM your address please? I'd like to take a look into this for you. ^Lance
2017-11-05 12:38:16,Hi Boss. No issues reported in your area. What issues are you having? ^Lance
2017-11-05 12:33:24,"Hi Teddy. NHL Network was discontinued by the broadcaster on September 1, 2015. It is no more. ^Lance"
2017-11-05 12:31:57,"Hmm, has the full guide downloaded yet? Swirl might be indicating that it can't find anything to record yet. ^Lance"
2017-11-05 12:30:44,It might have been updates that were slowing things down too. I did that large Windows update and it slowed down my whole network. ^Lance
2017-11-05 12:29:45,Best to send a DM. Then we can look at getting you a service call. ^Lance
2017-11-05 12:12:49,Hi Shady. Pulling the power cord usually works. Could you reconnect coaxial cable on the back of it then power cycle the once? ^Lance
2017-11-05 12:12:08,Hi Michael. Definitely credit you for time without services. Please follow and DM and I can take a look. ^Lance
2017-11-05 11:58:20,It can take a few minutes. ^Lance
2017-11-05 11:51:20,"Hi Lost. Yikes, tried to change time and got confused. Could you pull its power cord for 10 seconds, give it a quick reboot please? ^Lance"
2017-11-05 11:22:34,Previews and promos on specific channels or packages are under agreement with broadcaster. We can't do it for NFLST. Plz DM to order. ^Lance
2017-11-05 11:20:16,"Sorry, we aren't able to offer any previews on it. We can only add it with one payment. ^Lance"
2017-11-05 11:14:54,Hi Alliemaye! Happy to set you and/or grandpa up with our services! Bundles at https://www. shaw.ca or DM for more info! ^Lance
2017-11-05 11:13:15,Hi Jessy. It is $129 for the season. Please DM if you would like to add it. ^Lance
2017-11-05 10:46:07,Hi Rich. Let's take a look at your signal. Could you follow and DM your address pleae? Thanks! ^Lance
2017-11-05 10:27:59,We don't control what broadcaster decides to show. We only relay it from them to you. Tweeting the channel directly might be useful! ^Lance
